<?xml version="1.0" encoding="UTF-8" ?>
<xs:schema
        attributeFormDefault="unqualified"
        elementFormDefault="qualified"
        xmlns:xs="http://www.w3.org/2001/XMLSchema"
>
    <xs:element name="Categories">
        <xs:complexType>
            <xs:sequence>
                <xs:element name="Category" maxOccurs="unbounded" minOccurs="0">
                    <xs:complexType>
                        <xs:sequence>
                            <xs:element type="xs:string" name="Name"/>
                            <xs:element type="xs:string" name="Image"/>
                        </xs:sequence>
                        <xs:attribute type="xs:unsignedByte" name="Id" use="required"/>
                    </xs:complexType>
                </xs:element>
            </xs:sequence>
        </xs:complexType>
    </xs:element>
</xs:schema>